{
  "task_id": "demo_001",
  "benchmark": "Modelica Agent Workflow Benchmark",
  "benchmark_version": "v0.1-preview",
  "split": "public_demo",
  "task_type": "modelica_repair",
  "difficulty": "easy",
  "model_name": "ThermalZone_v0",
  "workflow_goal": "Repair this Modelica model so that it passes OpenModelica checkModel and simulation while preserving the declared public model interface.",
  "initial_model": "model ThermalZone_v0\n  // Multi-zone thermal model with explicit heat balance equations.\n  // No library dependencies. Represents a 3-zone building thermal network.\n\n  // Thermal capacitances [J/K]\n  parameter Real C1 = 2.5e6  \"zone 1 thermal capacitance\";\n  parameter Real C2 = 1.8e6  \"zone 2 thermal capacitance\";\n  parameter Real C3 = 1.2e6  \"zone 3 thermal capacitance\";\n  parameter Real Cw = 5.0e6  \"wall thermal capacitance\";\n\n  // Thermal conductances [W/K]\n  parameter Real H12  = 150.0  \"conductance zone1 to zone2\";\n  parameter Real H13  = 80.0   \"conductance zone1 to zone3\";\n  parameter Real H23  = 120.0  \"conductance zone2 to zone3\";\n  parameter Real H1w  = 200.0  \"conductance zone1 to wall\";\n  parameter Real H2w  = 180.0  \"conductance zone2 to wall\";\n  parameter Real Hwamb = 50.0  \"conductance wall to ambient\";\n\n  // Internal heat gains [W]\n  parameter Real Q1 = 2000.0  \"internal gain zone 1\";\n  parameter Real Q2 = 1500.0  \"internal gain zone 2\";\n  parameter Real Q3 = 800.0   \"internal gain zone 3\";\n\n  // Ambient temperature [K]\n  parameter Real T_amb = 268.15  \"ambient temperature (−5 °C)\";\n\n  // State variables\n  Real T1(start = 293.15)  \"temperature zone 1\";\n  Real T2(start = 291.15)  \"temperature zone 2\";\n  Real T3(start = \"290.15\") \"temperature zone 3\";\n  Real Tw(start = 280.15)  \"wall temperature\";\n\n  // Algebraic variables\n  Real Phi1  \"net heat flux into zone 1\";\n  Real Phi2  \"net heat flux into zone 2\";\n  Real Phi3  \"net heat flux into zone 3\";\n  Real PhiW  \"net heat flux into wall\";\n\nequation\n  // Heat flux balances\n  Phi1 = Q1 - H12*(T1 - T2) - H13*(T1 - T3) - H1w*(T1 - Tw);\n  Phi2 = Q2 + H12*(T1 - T2) - H23*(T2 - T3) - H2w*(T2 - Tw);\n  Phi3 = Q3 + H13*(T1 - T3) + H23*(T2 - T3);\n  PhiW = H1w*(T1 - Tw) + H2w*(T2 - Tw) - Hwamb*(Tw - T_amb);\n\n  // Thermal dynamics\n  der(T1) = Phi1 / C1;\n  der(T2) = Phi2 / C2;\n  der(T3) = Phi3 / C3;\n  der(Tw) = PhiW / Cw;\n\n  annotation(experiment(StartTime=0, StopTime=86400, Interval=60, Tolerance=1e-6));\nend ThermalZone_v0;\n",
  "verification": {
    "tool": "OpenModelica",
    "check_model": true,
    "simulate": {
      "intervals": 20,
      "stop_time": 1.0
    }
  },
  "acceptance": [
    "The final model must be complete Modelica source code.",
    "OpenModelica checkModel(model_name) must pass.",
    "OpenModelica simulate(model_name) must pass with the specified stop_time and intervals.",
    "The declared top-level model name and public interface should be preserved unless a change is required for validity."
  ]
}
